{
  "artifacts": [
    {
      "path": "artifacts/models/v3/ch04_rnn/ch4_household_power_rnn_pytorch_s17_main/best.npz",
      "sha256": "e3437f37fab6f26196f9a7d72601d4de29a1518a96f9143ed9167316bc054e82"
    },
    {
      "path": "artifacts/models/v3/ch04_rnn/ch4_household_power_rnn_pytorch_s17_main/best.json",
      "sha256": "5511295b71f317c738334c27aea3e5a118ef4abd7d933de4de0a82ecaa1e2911"
    },
    {
      "path": "artifacts/predictions/phase29/test/ch4_household_power_rnn_pytorch_s17_main.jsonl.gz",
      "sha256": "b6c35c78bae332a1aac121394de4acc2935b5ddc348ca49758e2b406da4112cb"
    },
    {
      "path": "artifacts/manifests/phase29/test_details/ch4_household_power_rnn_pytorch_s17_main.json",
      "sha256": "e46b4ddf3558b2ac5228f7d7eb83c8d738503b04b8c431ffcf999a5123065173"
    }
  ],
  "backend": "torch",
  "batch_size": 32,
  "code": {
    "dirty_tree_sha256": "c7aaafbe11688e15bbc33da23c0bc5558a42ed3662504a5ae018b4d4eb556c70",
    "git_commit": "e7cf49bce94ac9081a19f3cbee3657f027b21986"
  },
  "comparison_group_sha256": "dd3ea4b2dfb1067bc8ed7cf75c56c4e85feafe205301716db89d191856f1830c",
  "config_sha256": "32fb5c7a0b7ac3b096cd99a8a42006d5a698ba87a860d523aa15d679e0194604",
  "dataset_id": "ch4_household_power",
  "dataset_sha256": "db356f6739f2dbc8f493d383cface41cb84eed4ad572bbfd4b680519034539a1",
  "device": "cuda:0",
  "dtype": "float32",
  "efficiency": {
    "checkpoint_bytes": 29156,
    "inference_p50_ms": 0.7686634999117814,
    "inference_p95_ms": 0.9015248000650898,
    "peak_ram_bytes": null,
    "peak_vram_bytes": null,
    "timed_repeats": 30,
    "train_seconds": null,
    "warmup_batches": 5
  },
  "environment_sha256": "b0c71fd20e221ed3456278e1916079c46ac206831a98dcf40d3b8f7a83477862",
  "evidence_kind": "measured",
  "family": "rnn",
  "finished_at": "2026-10-20T00:08:24.088782+00:00",
  "implementation": "pytorch",
  "metrics": [
    {
      "direction": "min",
      "horizon": null,
      "name": "rmse",
      "undefined_reason": null,
      "unit": "kW",
      "value": 0.5876970895104232
    },
    {
      "direction": "min",
      "horizon": null,
      "name": "mae",
      "undefined_reason": null,
      "unit": "kW",
      "value": 0.4328763049498897
    },
    {
      "direction": "min",
      "horizon": null,
      "name": "smape",
      "undefined_reason": null,
      "unit": "percent",
      "value": 46.35811049074234
    },
    {
      "direction": "min",
      "horizon": null,
      "name": "macro_series_rmse",
      "undefined_reason": null,
      "unit": "kW",
      "value": 0.5876970895104232
    },
    {
      "direction": "min",
      "horizon": 1,
      "name": "rmse",
      "undefined_reason": null,
      "unit": "kW",
      "value": 0.5019478367713368
    },
    {
      "direction": "min",
      "horizon": 1,
      "name": "mae",
      "undefined_reason": null,
      "unit": "kW",
      "value": 0.3566479448350404
    },
    {
      "direction": "min",
      "horizon": 1,
      "name": "smape",
      "undefined_reason": null,
      "unit": "percent",
      "value": 38.115596513487645
    },
    {
      "direction": "min",
      "horizon": 24,
      "name": "rmse",
      "undefined_reason": null,
      "unit": "kW",
      "value": 0.6189370925564127
    },
    {
      "direction": "min",
      "horizon": 24,
      "name": "mae",
      "undefined_reason": null,
      "unit": "kW",
      "value": 0.4596504325106118
    },
    {
      "direction": "min",
      "horizon": 24,
      "name": "smape",
      "undefined_reason": null,
      "unit": "percent",
      "value": 48.93948543986612
    },
    {
      "direction": "min",
      "horizon": 6,
      "name": "rmse",
      "undefined_reason": null,
      "unit": "kW",
      "value": 0.633347338887168
    },
    {
      "direction": "min",
      "horizon": 6,
      "name": "mae",
      "undefined_reason": null,
      "unit": "kW",
      "value": 0.4823305375040169
    },
    {
      "direction": "min",
      "horizon": 6,
      "name": "smape",
      "undefined_reason": null,
      "unit": "percent",
      "value": 52.01924951887326
    }
  ],
  "model_contract": {
    "path": "artifacts/manifests/phase28/runs/ch4_household_power_rnn_pytorch_s17_main/model_contract.json",
    "sha256": "7b2bfc74c76003f79e9840cfef3f0d560c22dd918752cf2f4c246a01188d0f98"
  },
  "preprocessing": {
    "path": "artifacts/manifests/phase24/ch4_household_power/preprocessing.json",
    "sha256": "1940ded15fe9e51147e5dc0b4ec3dba661ef70a0462dabcec3875b011ca0909e"
  },
  "protocol_sha256": "25e197517f28075e760d1f5c3f110a8a0307203eaa04261d7271e0798fc06d6c",
  "run_id": "ch4_household_power_rnn_pytorch_s17_main",
  "schema_version": "phase29.recovery_test_run.1",
  "seed": 17,
  "split": "test",
  "split_id": "ch4_household_power_phase28_main",
  "split_sha256": "90053761ae0a15d0faa3323fb1a1261425d5204ab0e74416c225613e68f498b8",
  "started_at": "2026-10-20T00:08:24.088782+00:00",
  "status": "succeeded",
  "subset_sha256": "f6de2e1df1ddc0a78130d7bd5ccfe432dc94f143f295d176076ddd3049750a72",
  "test_seal_id": "ch4_household_power_phase29_joint_test_v1",
  "track": "matched_subset",
  "warnings": [
    "Latest revised snapshots, retrospective observation-origin forecast; no real-time publication/vintage claim or investment advice",
    "Each rolling fold uses its frozen scaler; windows reset recurrent state",
    "Train wall includes validation/progress I/O; RAM is process lifetime, VRAM allocator only; CPU/GPU and graph/eager differ",
    "Original training wall/RAM/VRAM telemetry lost before export failure; null, excluded from cost aggregates. Recovery process measurements are not original training measurements.",
    "started_at identifies recovery, not the lost original process start",
    "r2 strict native CPU export; original GPU/CPU result retained separately",
    "Schema-only TEST finalization from saved predictions, no new forward. started_at/finished_at are recovery record creation time; original TEST inference timestamps unavailable."
  ]
}
